title,article_link,category,date,page
Pemerintah Indonesia tidak melarang turis dari China terkait COVID-19? Ini faktanya,https://www.antaranews.com/berita/1347690/pemerintah-indonesia-tidak-melarang-turis-dari-china-terkait-covid-19-ini-faktanya,Dunia, 10 Maret 2020 21:07,81
Hoaks! Remaja bunuh anak lima tahun di Sawah Besar karena iri,https://www.antaranews.com/berita/1345382/hoaks-remaja-bunuh-anak-lima-tahun-di-sawah-besar-karena-iri,Hukum, 9 Maret 2020 20:15,81
Cek fakta: Benarkah Haedar Nashir imbau warga NU tidak belajar di sekolah Muhammadiyah?,https://www.antaranews.com/berita/1341146/cek-fakta-benarkah-haedar-nashir-imbau-warga-nu-tidak-belajar-di-sekolah-muhammadiyah,Politik, 6 Maret 2020 22:40,82
"Virus corona mati saat terkena sinar matahari, benarkah?",https://www.antaranews.com/berita/1337022/virus-corona-mati-saat-terkena-sinar-matahari-benarkah,Lifestyle, 5 Maret 2020 12:12,82
Penderita COVID-19 tidak ditanggung BPJS Kesehatan? Ini faktanya,https://www.antaranews.com/berita/1336102/penderita-covid-19-tidak-ditanggung-bpjs-kesehatan-ini-faktanya,Humaniora, 4 Maret 2020 20:40,82
"Tompi pesan masker hingga 20.000 kotak, benarkah?",https://www.antaranews.com/berita/1334234/tompi-pesan-masker-hingga-20000-kotak-benarkah,Hiburan, 4 Maret 2020 09:31,82
Benarkah Indonesia sediakan 1.000 tiket pesawat gratis untuk pulangkan WNI? Ini faktanya,https://www.antaranews.com/berita/1331378/benarkah-indonesia-sediakan-1000-tiket-pesawat-gratis-untuk-pulangkan-wni-ini-faktanya,Ekonomi, 3 Maret 2020 00:48,82
Benarkah Kemenkes tetapkan zona kuning terkait corona? Ini faktanya,https://www.antaranews.com/berita/1330578/benarkah-kemenkes-tetapkan-zona-kuning-terkait-corona-ini-faktanya,Humaniora, 2 Maret 2020 18:32,82
Benarkah pernyataan Trump soal COVID-19 di AS? Ini faktanya,https://www.antaranews.com/berita/1325930/benarkah-pernyataan-trump-soal-covid-19-di-as-ini-faktanya,Dunia, 28 Februari 2020 19:55,82
Kementerian PAN-RB angkat tenaga honorer dan Non-PNS? Ini faktanya,https://www.antaranews.com/berita/1325766/kementerian-pan-rb-angkat-tenaga-honorer-dan-non-pns-ini-faktanya,Politik, 28 Februari 2020 19:43,82
Penimbunan saluran drainase sebagai upaya sabotase terhadap Anies Baswedan? Ini faktanya,https://www.antaranews.com/berita/1322306/penimbunan-saluran-drainase-sebagai-upaya-sabotase-terhadap-anies-baswedan-ini-faktanya,Metro, 27 Februari 2020 13:59,82
"Kepala BPIP usulkan ""Assalamualaikum"" diganti ""Salam Pancasila""? Ini faktanya",https://www.antaranews.com/berita/1319630/kepala-bpip-usulkan-assalamualaikum-diganti-salam-pancasila-ini-faktanya,Politik, 26 Februari 2020 10:30,82
Dua bendungan di Jawa Barat penuh dan meluap? Cek faktanya,https://www.antaranews.com/berita/1318810/dua-bendungan-di-jawa-barat-penuh-dan-meluap-cek-faktanya,Warta Bumi, 25 Februari 2020 20:10,83
Virus corona dapat menyebar melalui gigitan nyamuk? Ini faktanya,https://www.antaranews.com/berita/1316242/virus-corona-dapat-menyebar-melalui-gigitan-nyamuk-ini-faktanya,Humaniora, 24 Februari 2020 19:05,83
Surabaya terancam gempa dari dua patahan yang membesar? Ini faktanya,https://www.antaranews.com/berita/1313594/surabaya-terancam-gempa-dari-dua-patahan-yang-membesar-ini-faktanya,Warta Bumi, 23 Februari 2020 08:25,83
Ashraf Sinclair meninggal karena serangan jantung dipicu GERD? Ini faktanya,https://www.antaranews.com/berita/1312066/ashraf-sinclair-meninggal-karena-serangan-jantung-dipicu-gerd-ini-faktanya,Lifestyle, 22 Februari 2020 00:04,83
"Disinformasi, pasien terduga corona di RSUD Bekasi",https://www.antaranews.com/berita/1309670/disinformasi-pasien-terduga-corona-di-rsud-bekasi,Humaniora, 20 Februari 2020 20:56,83
"Cek fakta: Gedung tempat isolasi warga China dari virus corona dibakar, benarkah?",https://www.antaranews.com/berita/1305674/cek-fakta-gedung-tempat-isolasi-warga-china-dari-virus-corona-dibakar-benarkah,Dunia, 19 Februari 2020 10:14,83
"Cek fakta: Pasien terjangkit virus corona di RSUP Haji Adam Malik Medan, benarkah?",https://www.antaranews.com/berita/1303258/cek-fakta-pasien-terjangkit-virus-corona-di-rsup-haji-adam-malik-medan-benarkah,Humaniora, 18 Februari 2020 10:09,83
Cek fakta: Benarkah sertifikasi halal dihilangkan dalam RUU Omnibus Law?,https://www.antaranews.com/berita/1299894/cek-fakta-benarkah-sertifikasi-halal-dihilangkan-dalam-ruu-omnibus-law,Humaniora, 16 Februari 2020 10:25,83
"Cek fakta: China berencana bunuh massal pasien virus corona, benarkah?",https://www.antaranews.com/berita/1298046/cek-fakta-china-berencana-bunuh-massal-pasien-virus-corona-benarkah,Dunia, 14 Februari 2020 21:52,83
Cek fakta: Orang kaya di Wuhan menghamburkan uang karena stres?,https://www.antaranews.com/berita/1295494/cek-fakta-orang-kaya-di-wuhan-menghamburkan-uang-karena-stres,Dunia, 13 Februari 2020 19:49,83
Cek fakta: Benarkah tujuh orang penumpang Lion Air terinfeksi corona?,https://www.antaranews.com/berita/1293218/cek-fakta-benarkah-tujuh-orang-penumpang-lion-air-terinfeksi-corona,Humaniora, 12 Februari 2020 20:52,84
"Disinformasi, serangan virus corona masuk dari 19 bandara di Indonesia",https://www.antaranews.com/berita/1291554/disinformasi-serangan-virus-corona-masuk-dari-19-bandara-di-indonesia,Humaniora, 12 Februari 2020 12:10,84
Garuda Indonesia panggil tes wawancara di Bali? Ini faktanya,https://www.antaranews.com/berita/1289202/garuda-indonesia-panggil-tes-wawancara-di-bali-ini-faktanya,Ekonomi, 11 Februari 2020 11:12,84
Cek fakta: Benarkah rakyat non-muslim China ikut shalat karena takut corona?,https://www.antaranews.com/berita/1288078/cek-fakta-benarkah-rakyat-non-muslim-china-ikut-shalat-karena-takut-corona,Dunia, 10 Februari 2020 18:56,84
Cek fakta: Xi Jinping minta umat Islam berdoa untuk China,https://www.antaranews.com/berita/1285090/cek-fakta-xi-jinping-minta-umat-islam-berdoa-untuk-china,Dunia, 8 Februari 2020 19:47,84
Cek fakta: Benarkah WHO serukan isolasi China terkait virus corona baru?,https://www.antaranews.com/berita/1283606/cek-fakta-benarkah-who-serukan-isolasi-china-terkait-virus-corona-baru,Dunia, 7 Februari 2020 19:33,84
"Disinformasi: Daftar lokasi rawan kejahatan ""klitih"" di Yogyakarta",https://www.antaranews.com/berita/1282298/disinformasi-daftar-lokasi-rawan-kejahatan-klitih-di-yogyakarta,Hukum, 6 Februari 2020 22:16,84
Cek fakta: Benarkah 40 ribu TKA China di Morowali jalani karantina terkait corona?,https://www.antaranews.com/berita/1280007/cek-fakta-benarkah-40-ribu-tka-china-di-morowali-jalani-karantina-terkait-corona,Ekonomi, 5 Februari 2020 10:48,84
Inilah 56 hoaks terkait virus corona,https://www.antaranews.com/berita/1278357/inilah-56-hoaks-terkait-virus-corona,Humaniora, 4 Februari 2020 10:08,84
Benarkah virus corona dapat menular dari makanan?,https://www.antaranews.com/berita/1278149/benarkah-virus-corona-dapat-menular-dari-makanan,Humaniora, 4 Februari 2020 06:06,84
Cek fakta: Foto mayat-mayat bergelimpangan di jalanan Wuhan,https://www.antaranews.com/berita/1276357/cek-fakta-foto-mayat-mayat-bergelimpangan-di-jalanan-wuhan,Humaniora, 3 Februari 2020 07:14,85
"Disinformasi, pasien corona dirawat di RSUD Rabain Muara Enim",https://www.antaranews.com/berita/1276165/disinformasi-pasien-corona-dirawat-di-rsud-rabain-muara-enim,Humaniora, 2 Februari 2020 22:39,85
Cek fakta: Benarkah dua penumpang Lion Air meninggal karena corona?,https://www.antaranews.com/berita/1275917/cek-fakta-benarkah-dua-penumpang-lion-air-meninggal-karena-corona,Humaniora, 2 Februari 2020 18:45,85
Cek fakta: Pasien terduga infeksi corona di Semarang meninggal?,https://www.antaranews.com/berita/1275299/cek-fakta-pasien-terduga-infeksi-corona-di-semarang-meninggal,Humaniora, 2 Februari 2020 05:56,85
"Video helikopter Kobe Bryant jatuh jadi viral, ini penjelasannya",https://www.antaranews.com/berita/1270111/video-helikopter-kobe-bryant-jatuh-jadi-viral-ini-penjelasannya,Olahraga, 29 Januari 2020 08:15,85
Benarkah bawang putih dapat obati infeksi corona?,https://www.antaranews.com/berita/1269619/benarkah-bawang-putih-dapat-obati-infeksi-corona,Lifestyle, 28 Januari 2020 19:54,85
"Beredar video warga China berlarian, benarkah panik karena corona?",https://www.antaranews.com/berita/1268009/beredar-video-warga-china-berlarian-benarkah-panik-karena-corona,Dunia, 27 Januari 2020 20:55,85
"Disinformasi, virus corona menyebar di RSUP Sardjito",https://www.antaranews.com/berita/1267649/disinformasi-virus-corona-menyebar-di-rsup-sardjito,Humaniora, 27 Januari 2020 17:45,85
"Pertamina membuka lowongan pekerjaan awal 2020, ini penjelasannya",https://www.antaranews.com/berita/1266729/pertamina-membuka-lowongan-pekerjaan-awal-2020-ini-penjelasannya,Ekonomi, 27 Januari 2020 08:56,85
"Benarkah Nadiem Makarim menulis pesan IPK, NEM dan ranking tidak perlu?",https://www.antaranews.com/berita/1264497/benarkah-nadiem-makarim-menulis-pesan-ipk-nem-dan-ranking-tidak-perlu,Humaniora, 24 Januari 2020 22:05,85
"Pelajar bunuh begal demi lindungi pacar didakwa seumur hidup, benarkah?",https://www.antaranews.com/berita/1262919/pelajar-bunuh-begal-demi-lindungi-pacar-didakwa-seumur-hidup-benarkah,Hukum, 23 Januari 2020 22:02,86
"Disinformasi, video camilan kelapa isi pil pelumpuh",https://www.antaranews.com/berita/1261423/disinformasi-video-camilan-kelapa-isi-pil-pelumpuh,Lifestyle, 23 Januari 2020 10:25,86
"Beredar video empedu berisi boba, ini penjelasannya",https://www.antaranews.com/berita/1260883/beredar-video-empedu-berisi-boba-ini-penjelasannya,Lifestyle, 22 Januari 2020 20:44,86
Benarkah PLN membuka lowongan kerja pada awal 2020?,https://www.antaranews.com/berita/1259232/benarkah-pln-membuka-lowongan-kerja-pada-awal-2020,Ekonomi, 21 Januari 2020 23:35,86
"Disinformasi, Raja Agung Sejagad: Yang Plonga Plongo Bisa Jadi Pemimpin",https://www.antaranews.com/berita/1258884/disinformasi-raja-agung-sejagad-yang-plonga-plongo-bisa-jadi-pemimpin,Humaniora, 21 Januari 2020 19:54,86
"Bupati Boven Digoel diisukan meninggal usai berzina, ini penjelasannya",https://www.antaranews.com/berita/1257175/bupati-boven-digoel-diisukan-meninggal-usai-berzina-ini-penjelasannya,Politik, 20 Januari 2020 19:06,86
"Disinformasi, Megawati suap Ketua KPU Arief Budiman Rp2 triliun",https://www.antaranews.com/berita/1254390/disinformasi-megawati-suap-ketua-kpu-arief-budiman-rp2-triliun,Politik, 17 Januari 2020 20:44,86
"CNN Indonesia tulis berita ""Banjir Jakarta Adalah Air Mata Malaikat Yang Jatuh"", benarkah?",https://www.antaranews.com/berita/1253189/cnn-indonesia-tulis-berita-banjir-jakarta-adalah-air-mata-malaikat-yang-jatuh-benarkah,Metro, 16 Januari 2020 20:57,86
"Foto-foto pasukan AS yang terluka viral, benarkah akibat perlawanan Iran?",https://www.antaranews.com/berita/1251836/foto-foto-pasukan-as-yang-terluka-viral-benarkah-akibat-perlawanan-iran,Dunia, 15 Januari 2020 20:56,86
"Disinformasi, Menag ingin Bahasa Mandarin syarat lulus madrasah aliyah",https://www.antaranews.com/berita/1250247/disinformasi-menag-ingin-bahasa-mandarin-syarat-lulus-madrasah-aliyah,Humaniora, 14 Januari 2020 20:31,86
Donald Trump takut dengan seruan takbir? Ini penjelasannya,https://www.antaranews.com/berita/1248268/donald-trump-takut-dengan-seruan-takbir-ini-penjelasannya,Dunia, 13 Januari 2020 18:53,87
Benarkah denda tilang tidak punya SIM Rp25 ribu?,https://www.antaranews.com/berita/1246240/benarkah-denda-tilang-tidak-punya-sim-rp25-ribu,Hukum, 11 Januari 2020 22:30,87
"China membangun pangkalan militer di Natuna, ini penjelasannya",https://www.antaranews.com/berita/1245271/china-membangun-pangkalan-militer-di-natuna-ini-penjelasannya,Politik, 10 Januari 2020 21:42,87
Benarkah Deddy Corbuzier mendapatkan serangan fisik?,https://www.antaranews.com/berita/1243551/benarkah-deddy-corbuzier-mendapatkan-serangan-fisik,Hiburan, 9 Januari 2020 21:52,87
"Banjir besar berulang di Jakarta akibat pasang-surut laut satu meter, benarkah?",https://www.antaranews.com/berita/1241151/banjir-besar-berulang-di-jakarta-akibat-pasang-surut-laut-satu-meter-benarkah,Warta Bumi, 8 Januari 2020 17:42,87
"Misinformasi, Jokowi Impor TKA China Karena Kualitas Tenaga Kerja RI Rendah",https://www.antaranews.com/berita/1240312/misinformasi-jokowi-impor-tka-china-karena-kualitas-tenaga-kerja-ri-rendah,Ekonomi, 8 Januari 2020 10:37,87
"Benarkah gempa Lombok sebabkan ""megathrust"" Pulau Jawa dalam waktu dekat?",https://www.antaranews.com/berita/1239668/benarkah-gempa-lombok-sebabkan-megathrust-pulau-jawa-dalam-waktu-dekat,Warta Bumi, 7 Januari 2020 19:57,87
"Hoaks, video sabu dalam nanas terjadi di Indonesia",https://www.antaranews.com/berita/1238531/hoaks-video-sabu-dalam-nanas-terjadi-di-indonesia,Hukum, 7 Januari 2020 10:59,87
"Benarkah ""Halal Park"" Soekarno-Hatta hanya diperuntukkan bagi muslim?",https://www.antaranews.com/berita/1238163/benarkah-halal-park-soekarno-hatta-hanya-diperuntukkan-bagi-muslim,Lifestyle, 6 Januari 2020 22:13,87
"Surabaya dikabarkan juga terkepung banjir, ini penjelasannya",https://www.antaranews.com/berita/1236480/surabaya-dikabarkan-juga-terkepung-banjir-ini-penjelasannya,Warta Bumi, 5 Januari 2020 20:32,87
"Disinformasi, Megawati minta Jokowi cari wapres baru gantikan Ma'ruf Amin",https://www.antaranews.com/berita/1236380/disinformasi-megawati-minta-jokowi-cari-wapres-baru-gantikan-maruf-amin,Politik, 5 Januari 2020 18:14,88
"Video buaya masuk permukiman warga saat banjir, ini penjelasannya",https://www.antaranews.com/berita/1234599/video-buaya-masuk-permukiman-warga-saat-banjir-ini-penjelasannya,Warta Bumi, 3 Januari 2020 22:38,88
"Disinformasi, saat tangani banjir Anies tak diliput media",https://www.antaranews.com/berita/1233687/disinformasi-saat-tangani-banjir-anies-tak-diliput-media,Metro, 3 Januari 2020 12:58,88
Benarkah Anies dan Bima Arya swafoto di Katulampa saat banjir?,https://www.antaranews.com/berita/1233019/benarkah-anies-dan-bima-arya-swafoto-di-katulampa-saat-banjir,Metro, 2 Januari 2020 21:23,88
"Hoaks, peringatan tsunami di Bengkulu pada malam tahun baru 2020",https://www.antaranews.com/berita/1230220/hoaks-peringatan-tsunami-di-bengkulu-pada-malam-tahun-baru-2020,Warta Bumi, 31 Desember 2019 19:21,88
Benarkah dana Jiwasraya tersalurkan dalam kampanye Pilpres 2019?,https://www.antaranews.com/berita/1230188/benarkah-dana-jiwasraya-tersalurkan-dalam-kampanye-pilpres-2019,Ekonomi, 31 Desember 2019 17:17,88
"Foto pohon Natal di Masjid Gedhe Kauman Yogyakarta, ini penjelasan keraton",https://www.antaranews.com/berita/1229891/foto-pohon-natal-di-masjid-gedhe-kauman-yogyakarta-ini-penjelasan-keraton,Humaniora, 31 Desember 2019 13:08,88
"Disinformasi, pendiri MER-C dikabarkan meninggal dunia",https://www.antaranews.com/berita/1229175/disinformasi-pendiri-mer-c-dikabarkan-meninggal-dunia,Humaniora, 30 Desember 2019 18:28,88
"Hoaks, foto kartu agen Mossad Hendropriyono",https://www.antaranews.com/berita/1226931/hoaks-foto-kartu-agen-mossad-hendropriyono,Politik, 28 Desember 2019 18:09,88
"Foto Mesut Ozil injak bendera China, ini penjelasannya",https://www.antaranews.com/berita/1225975/foto-mesut-ozil-injak-bendera-china-ini-penjelasannya,Sepakbola, 27 Desember 2019 18:20,88
"Hoaks, akun Kominfo di situs PornHub",https://www.antaranews.com/berita/1224748/hoaks-akun-kominfo-di-situs-pornhub,Tekno, 26 Desember 2019 17:53,89
"Diskriminasi nama Muhammad di Bandara Soekarno-Hatta, benarkah terjadi?",https://www.antaranews.com/berita/1224912/diskriminasi-nama-muhammad-di-bandara-soekarno-hatta-benarkah-terjadi,Hukum, 26 Desember 2019 16:37,89
"Disinformasi, polisi imbau petugas hotel di Banyuwangi tidak pasang atribut Natal",https://www.antaranews.com/berita/1222772/disinformasi-polisi-imbau-petugas-hotel-di-banyuwangi-tidak-pasang-atribut-natal,Hukum, 24 Desember 2019 21:12,89
Benarkah Aa Gym kirim pesan berantai tentang ucapan Natal?,https://www.antaranews.com/berita/1221127/benarkah-aa-gym-kirim-pesan-berantai-tentang-ucapan-natal,Humaniora, 23 Desember 2019 16:06,89
"Cek fakta, foto-foto penyiksaan etnis Uighur",https://www.antaranews.com/berita/1220215/cek-fakta-foto-foto-penyiksaan-etnis-uighur,Dunia, 22 Desember 2019 23:09,89
"Harimau masuki sebuah pabrik di Riau, ini penjelasannya",https://www.antaranews.com/berita/1219868/harimau-masuki-sebuah-pabrik-di-riau-ini-penjelasannya,Humaniora, 22 Desember 2019 18:33,89
"""Fatimah Aynur"" perempuan Uighur yang disiksa China, benarkah?",https://www.antaranews.com/berita/1219500/fatimah-aynur-perempuan-uighur-yang-disiksa-china-benarkah,Dunia, 22 Desember 2019 12:14,89
"""Larangan Bersholawat"", benarkah dilarang?",https://www.antaranews.com/berita/1218407/larangan-bersholawat-benarkah-dilarang,Humaniora, 20 Desember 2019 22:13,89
"Bawang merah atasi gigitan ular berbisa, ini penjelasannya",https://www.antaranews.com/berita/1216887/bawang-merah-atasi-gigitan-ular-berbisa-ini-penjelasannya,Metro, 19 Desember 2019 21:20,89
Disinformasi nata de coco terbuat dari plastik,https://www.antaranews.com/berita/1214728/disinformasi-nata-de-coco-terbuat-dari-plastik,Lifestyle, 18 Desember 2019 19:08,89
"Hoaks, Kemendagri ancam copot kepala daerah pemilik rekening kasino",https://www.antaranews.com/berita/1213700/hoaks-kemendagri-ancam-copot-kepala-daerah-pemilik-rekening-kasino,Politik, 18 Desember 2019 09:33,90
"Video permintaan maaf pelaku persekusi Banser NU, hanya sandiwara?",https://www.antaranews.com/berita/1213668/video-permintaan-maaf-pelaku-persekusi-banser-nu-hanya-sandiwara,Hukum, 17 Desember 2019 19:03,90
"Hoaks, Ari Askhara anggota BIN",https://www.antaranews.com/berita/1212915/hoaks-ari-askhara-anggota-bin,Politik, 17 Desember 2019 15:33,90
Muhammadiyah terima suap dari China karena isu Uighur?,https://www.antaranews.com/berita/1211340/muhammadiyah-terima-suap-dari-china-karena-isu-uighur,Dunia, 16 Desember 2019 20:09,90
"Hoaks, Mendikbud Nadiem resmi hapus Ujian Nasional mulai 2021",https://www.antaranews.com/berita/1211296/hoaks-mendikbud-nadiem-resmi-hapus-ujian-nasional-mulai-2021,Humaniora, 16 Desember 2019 19:50,90
"Mendikbud Nadiem hapus Ujian Nasional mulai 2021, benarkah?",https://www.antaranews.com/berita/1211300/mendikbud-nadiem-hapus-ujian-nasional-mulai-2021-benarkah,Humaniora, 16 Desember 2019 19:50,90
"Foto tol Japek bergelombang disebut ""fake"", benarkah?",https://www.antaranews.com/berita/1208199/foto-tol-japek-bergelombang-disebut-fake-benarkah,Ekonomi, 13 Desember 2019 18:23,90
"Informasi uji coba 4 hari kerja bagi PNS, ini penjelasannya",https://www.antaranews.com/berita/1207315/informasi-uji-coba-4-hari-kerja-bagi-pns-ini-penjelasannya,Politik, 13 Desember 2019 10:53,90
"Hoaks, foto Prabowo bertuliskan ""FPI bukan mengancam kedaulatan NKRI""",https://www.antaranews.com/berita/1205375/hoaks-foto-prabowo-bertuliskan-fpi-bukan-mengancam-kedaulatan-nkri,Politik, 11 Desember 2019 22:04,90
"Fatayat NU minta beras ke Gereja Kristen Indonesia, ini penjelasannya",https://www.antaranews.com/berita/1203080/fatayat-nu-minta-beras-ke-gereja-kristen-indonesia-ini-penjelasannya,Humaniora, 10 Desember 2019 19:35,90
"Hoaks, video pria gangguan jiwa akibat kecanduan game ""online""",https://www.antaranews.com/berita/1201183/hoaks-video-pria-gangguan-jiwa-akibat-kecanduan-game-online,Lifestyle, 9 Desember 2019 19:01,91
"Hoaks, STIKOM Bali terpapar ISIS",https://www.antaranews.com/berita/1200595/hoaks-stikom-bali-terpapar-isis,Humaniora, 9 Desember 2019 10:22,91
"Sri Mulyani dituduh gunakan barang-barang selundupan, benarkah?",https://www.antaranews.com/berita/1199163/sri-mulyani-dituduh-gunakan-barang-barang-selundupan-benarkah,Ekonomi, 8 Desember 2019 13:21,91
"Hoaks, selebaran waspadai penculikan anak dari Polresta Sidoarjo",https://www.antaranews.com/berita/1196328/hoaks-selebaran-waspadai-penculikan-anak-dari-polresta-sidoarjo,Hukum, 6 Desember 2019 09:40,91
"Hoaks, perusahaan China Alipay ancam kedaulatan ekonomi lewat Dana",https://www.antaranews.com/berita/1195679/hoaks-perusahaan-china-alipay-ancam-kedaulatan-ekonomi-lewat-dana,Ekonomi, 5 Desember 2019 18:54,91
Benarkah Wamenag sebut Reuni 212 berpotensi menimbulkan dosa?,https://www.antaranews.com/berita/1194044/benarkah-wamenag-sebut-reuni-212-berpotensi-menimbulkan-dosa,Humaniora, 4 Desember 2019 20:47,91
"Spanduk TNI siapkan sarapan gratis bagi peserta Reuni 212, ini penjelasannya",https://www.antaranews.com/berita/1192815/spanduk-tni-siapkan-sarapan-gratis-bagi-peserta-reuni-212-ini-penjelasannya,Politik, 3 Desember 2019 22:09,91
Kominfo identifikasi 3.901 hoaks sejak Agustus 2018,https://www.antaranews.com/berita/1192208/kominfo-identifikasi-3901-hoaks-sejak-agustus-2018,Tekno, 3 Desember 2019 21:19,91
Benarkah atlet muslim Indonesia disuguhi babi di SEA Games 2019,https://www.antaranews.com/berita/1190220/benarkah-atlet-muslim-indonesia-disuguhi-babi-di-sea-games-2019,Olahraga, 2 Desember 2019 20:15,91
"Eep Saefullah dan istrinya pemilik toko Tous Les Jours, benarkah?",https://www.antaranews.com/berita/1180356/eep-saefullah-dan-istrinya-pemilik-toko-tous-les-jours-benarkah,Hukum, 26 November 2019 09:04,91
Benarkah nomor registrasi CPNS 2019 menunjukkan jumlah pesaing?,https://www.antaranews.com/berita/1179676/benarkah-nomor-registrasi-cpns-2019-menunjukkan-jumlah-pesaing,Politik, 25 November 2019 18:48,92
"Hoaks, surat panggilan tes wawancara Pertamina 21-22 November",https://www.antaranews.com/berita/1174840/hoaks-surat-panggilan-tes-wawancara-pertamina-21-22-november,Ekonomi, 21 November 2019 20:16,92
"BMKG perkirakan terjadi kemarau panjang bertahun-tahun, ini penjelasannya",https://www.antaranews.com/berita/1171108/bmkg-perkirakan-terjadi-kemarau-panjang-bertahun-tahun-ini-penjelasannya,Humaniora, 19 November 2019 20:16,92
"Hoaks, foto Ahok bersama dua wanita jadi alasan Alexis dipertahankan",https://www.antaranews.com/berita/1168855/hoaks-foto-ahok-bersama-dua-wanita-jadi-alasan-alexis-dipertahankan,Politik, 18 November 2019 16:46,92
"Warga Seririt eksodus karena air Pantai Pangastulan surut, ini penjelasannya",https://www.antaranews.com/berita/1166115/warga-seririt-eksodus-karena-air-pantai-pangastulan-surut-ini-penjelasannya,Humaniora, 16 November 2019 10:24,92
"Hoaks, pria meledak di Poltabes Medan adalah pengemudi ""ojol"" yang dijebak",https://www.antaranews.com/berita/1165535/hoaks-pria-meledak-di-poltabes-medan-adalah-pengemudi-ojol-yang-dijebak,Politik, 15 November 2019 18:33,92
"Hoaks, kertas bertuliskan ""Sejarah Hitam DKI"" yang dibawa Sandiaga",https://www.antaranews.com/berita/1163591/hoaks-kertas-bertuliskan-sejarah-hitam-dki-yang-dibawa-sandiaga,Politik, 14 November 2019 17:46,92
"Hoaks, Jokowi pakai kaus dengan tulisan 'Aica Aibon'",https://www.antaranews.com/berita/1161827/hoaks-jokowi-pakai-kaus-dengan-tulisan-aica-aibon,Politik, 13 November 2019 19:18,92
"Informasi loker tenaga kebersihan kebun binatang Ragunan, ini penjelasannya",https://www.antaranews.com/berita/1159667/informasi-loker-tenaga-kebersihan-kebun-binatang-ragunan-ini-penjelasannya,Metro, 12 November 2019 17:59,92
"Hoaks, Jokowi pindahkan ibu kota karena tamu asing suka bertemu Anies",https://www.antaranews.com/berita/1157867/hoaks-jokowi-pindahkan-ibu-kota-karena-tamu-asing-suka-bertemu-anies,Politik, 11 November 2019 18:07,92
"Hoaks, lowongan kerja di Dinas Pemberdayaan Masyarakat Desa Jabar",https://www.antaranews.com/berita/1140808/hoaks-lowongan-kerja-di-dinas-pemberdayaan-masyarakat-desa-jabar,Humaniora, 31 Oktober 2019 18:08,93
"Hoaks, Grace Natalie kecewa tak jadi menteri padahal pintar kupas salak",https://www.antaranews.com/berita/1139840/hoaks-grace-natalie-kecewa-tak-jadi-menteri-padahal-pintar-kupas-salak,Politik, 31 Oktober 2019 11:21,93
"Beredar pesan berantai lowongan kerja PT Angkasa Pura, ini penjelasannya",https://www.antaranews.com/berita/1137748/beredar-pesan-berantai-lowongan-kerja-pt-angkasa-pura-ini-penjelasannya,Ekonomi, 30 Oktober 2019 01:09,93
"Informasi  penembakan Anggota Densus 88 di Kabupaten Intan Jaya, ini penjelasannya",https://www.antaranews.com/berita/1136096/informasi-penembakan-anggota-densus-88-di-kabupaten-intan-jaya-ini-penjelasannya,Hukum, 29 Oktober 2019 00:52,93
"Hoaks, tangkapan layar grup WhatsApp Pendukung 02",https://www.antaranews.com/berita/1135456/hoaks-tangkapan-layar-grup-whatsapp-pendukung-02,Politik, 28 Oktober 2019 17:52,93
"Hoaks, BPJS Kesehatan blokir pelanggan yang memiliki kendaraan bermotor lebih dari satu",https://www.antaranews.com/berita/1134404/hoaks-bpjs-kesehatan-blokir-pelanggan-yang-memiliki-kendaraan-bermotor-lebih-dari-satu,Humaniora, 27 Oktober 2019 19:41,93
"Hoaks, surat BKN tentang pembekalan CPNS berbiaya Rp750.000",https://www.antaranews.com/berita/1134399/hoaks-surat-bkn-tentang-pembekalan-cpns-berbiaya-rp750000,Politik, 27 Oktober 2019 17:09,93
"Hoaks, gelombang panas ekstrem landa Indonesia hingga tiga hari ke depan",https://www.antaranews.com/berita/1127919/hoaks-gelombang-panas-ekstrem-landa-indonesia-hingga-tiga-hari-ke-depan,Humaniora, 23 Oktober 2019 16:05,93
"Janji Jokowi meningkatkan penghasilan rakyat Rp27 juta perbulan, ini penjelasannya",https://www.antaranews.com/berita/1127639/janji-jokowi-meningkatkan-penghasilan-rakyat-rp27-juta-perbulan-ini-penjelasannya,Politik, 23 Oktober 2019 15:16,93
"Istri Ma'ruf Amin gunakan tas Hermes saat pelantikan, ini penjelasannya",https://www.antaranews.com/berita/1126688/istri-maruf-amin-gunakan-tas-hermes-saat-pelantikan-ini-penjelasannya,Politik, 22 Oktober 2019 21:57,93
"Gibran Rakabuming maju Pilkada Solo melalui jalur independen, ini penjelasannya",https://www.antaranews.com/berita/1126692/gibran-rakabuming-maju-pilkada-solo-melalui-jalur-independen-ini-penjelasannya,Politik, 22 Oktober 2019 19:34,94
"Hoaks, libur kabut asap di Palembang diperpanjang dari 21-24 Oktober 2019",https://www.antaranews.com/berita/1126183/hoaks-libur-kabut-asap-di-palembang-diperpanjang-dari-21-24-oktober-2019,Humaniora, 22 Oktober 2019 14:46,94
"Polisi amankan mobil bermuatan bahan peledak di Mega Kuningan, ini penjelasannya",https://www.antaranews.com/berita/1124003/polisi-amankan-mobil-bermuatan-bahan-peledak-di-mega-kuningan-ini-penjelasannya,Hukum, 21 Oktober 2019 14:31,94
